{
  "$schema": "./language.schema.json",
  "name": "Arabic",
  "direction": "rtl",
  "letters": [
    "ا",
    "ب",
    "ت",
    "ث",
    "ج",
    "ح",
    "خ",
    "د",
    "ذ",
    "ر",
    "ز",
    "س",
    "ش",
    "ص",
    "ض",
    "ط",
    "ظ",
    "ع",
    "غ",
    "ف",
    "ق",
    "ك",
    "ل",
    "م",
    "ن",
    "ه",
    "و",
    "ي",
    "ء",
    "ة",
    "ى"
  ],
  "keyboardLayout": [
    [
      { "type": "letter", "value": "ض", "width": 2 },
      { "type": "letter", "value": "ص", "width": 2 },
      { "type": "letter", "value": "ث", "width": 2 },
      { "type": "letter", "value": "ق", "width": 2 },
      { "type": "letter", "value": "ف", "width": 2 },
      { "type": "letter", "value": "غ", "width": 2 },
      { "type": "letter", "value": "ع", "width": 2 },
      { "type": "letter", "value": "ه", "width": 2 },
      { "type": "letter", "value": "خ", "width": 2 },
      { "type": "letter", "value": "ح", "width": 2 },
      { "type": "letter", "value": "ج", "width": 2 },
      { "type": "letter", "value": "د", "width": 2 }
    ],
    [
      { "type": "letter", "value": "ش", "width": 2 },
      { "type": "letter", "value": "س", "width": 2 },
      { "type": "letter", "value": "ي", "width": 2 },
      { "type": "letter", "value": "ب", "width": 2 },
      { "type": "letter", "value": "ل", "width": 2 },
      { "type": "letter", "value": "ا", "width": 2 },
      { "type": "letter", "value": "ت", "width": 2 },
      { "type": "letter", "value": "ن", "width": 2 },
      { "type": "letter", "value": "م", "width": 2 },
      { "type": "letter", "value": "ك", "width": 2 },
      { "type": "letter", "value": "ط", "width": 2 },
      { "type": "letter", "value": "ذ", "width": 2 }
    ],
    [
      { "type": "enter", "width": 3 },
      { "type": "letter", "value": "ئ", "width": 2 },
      { "type": "letter", "value": "ء", "width": 2 },
      { "type": "letter", "value": "ؤ", "width": 2 },
      { "type": "letter", "value": "ر", "width": 2 },
      { "type": "letter", "value": "ى", "width": 2 },
      { "type": "letter", "value": "ة", "width": 2 },
      { "type": "letter", "value": "و", "width": 2 },
      { "type": "letter", "value": "ز", "width": 2 },
      { "type": "letter", "value": "ظ", "width": 2 },
      { "type": "backspace", "width": 3 }
    ]
  ],
  "normalization": {},
  "dictionary": {}
}
